{
  "artifact_id": "M8-WORKFLOW-STATE-3A528F1E3D922CBAF4D1AC7B3D282E385D8158D3270ED3117B88F2075429F85C",
  "artifact_type": "workflow-state",
  "content": {
    "ambiguities": [],
    "approval_ids": [],
    "blockers": [],
    "candidate": {
      "git_head": "bbbbbbbbbbbbbbbbbbbbbbbbbbbbbbbbbbbbbbbb",
      "repository_digest": "CCCCCCCCCCCCCCCCCCCCCCCCCCCCCCCCCCCCCCCCCCCCCCCCCCCCCCCCCCCCCCCC",
      "source_spec_sha256": "050EA855693A9DD43303872934824E4B116A9210CECBD3CAA6F24F9EB9823FF4"
    },
    "event_chain": [
      {
        "artifact_id": "M8-WORKFLOW-EVENT-B200B4C39310BDE44B7B5AC57FD6E13C852FC90C83E77BB8647F2C6631356AA0",
        "artifact_type": "workflow-event",
        "reference": {
          "path": "examples/m8-workflow/workflow-event.json",
          "sha256": "2936ADC93C379723BDD90FB564755944904A2BEA00F8DD10A550CD9D8BB14270"
        },
        "required": true
      }
    ],
    "evidence_ids": [],
    "gates": [
      {
        "blocker_codes": [],
        "evidence_ids": [
          "RB-050EA855693A9DD4"
        ],
        "gate_id": "G1",
        "status": "PASS"
      }
    ],
    "handoff_id": null,
    "handoff_status": null,
    "latest_event": {
      "artifact_id": "M8-WORKFLOW-EVENT-B200B4C39310BDE44B7B5AC57FD6E13C852FC90C83E77BB8647F2C6631356AA0",
      "artifact_type": "workflow-event",
      "reference": {
        "path": "examples/m8-workflow/workflow-event.json",
        "sha256": "2936ADC93C379723BDD90FB564755944904A2BEA00F8DD10A550CD9D8BB14270"
      },
      "required": true
    },
    "measurements": [
      {
        "name": "requirements.required_requirement_count",
        "source_ids": [
          "CTX-SELECTION-3D7E2B0CCDD5C9E637505CBF13F434C4F8DE35100B22EAC4C0C0CC0C7313D5AC",
          "M6-SCHEDULER-STATE-4CAEFB3BD990A30DF7662EBCEBB80F227BB122150E5CA8185366376042A825E2",
          "M6-TASK-GRAPH-812F1666FD65A7A3251D6414346308EBC5BEA7FDEE488408A3A59BFDDA003BE6",
          "M8-INTEGRATED-PLAN-A6C0C7D763505EDA73A7864140C50B094E42ECA48CA26604FC9ADE9AF492A87D",
          "M8-WORKFLOW-EVENT-B200B4C39310BDE44B7B5AC57FD6E13C852FC90C83E77BB8647F2C6631356AA0"
        ],
        "status": "observed",
        "unit": "count",
        "value": 1
      },
      {
        "name": "requirements.covered_requirement_count",
        "source_ids": [
          "CTX-SELECTION-3D7E2B0CCDD5C9E637505CBF13F434C4F8DE35100B22EAC4C0C0CC0C7313D5AC",
          "M6-SCHEDULER-STATE-4CAEFB3BD990A30DF7662EBCEBB80F227BB122150E5CA8185366376042A825E2",
          "M6-TASK-GRAPH-812F1666FD65A7A3251D6414346308EBC5BEA7FDEE488408A3A59BFDDA003BE6",
          "M8-INTEGRATED-PLAN-A6C0C7D763505EDA73A7864140C50B094E42ECA48CA26604FC9ADE9AF492A87D",
          "M8-WORKFLOW-EVENT-B200B4C39310BDE44B7B5AC57FD6E13C852FC90C83E77BB8647F2C6631356AA0"
        ],
        "status": "observed",
        "unit": "count",
        "value": 1
      },
      {
        "name": "requirements.uncovered_requirement_ids",
        "source_ids": [
          "CTX-SELECTION-3D7E2B0CCDD5C9E637505CBF13F434C4F8DE35100B22EAC4C0C0CC0C7313D5AC",
          "M6-SCHEDULER-STATE-4CAEFB3BD990A30DF7662EBCEBB80F227BB122150E5CA8185366376042A825E2",
          "M6-TASK-GRAPH-812F1666FD65A7A3251D6414346308EBC5BEA7FDEE488408A3A59BFDDA003BE6",
          "M8-INTEGRATED-PLAN-A6C0C7D763505EDA73A7864140C50B094E42ECA48CA26604FC9ADE9AF492A87D",
          "M8-WORKFLOW-EVENT-B200B4C39310BDE44B7B5AC57FD6E13C852FC90C83E77BB8647F2C6631356AA0"
        ],
        "status": "observed",
        "unit": "identifier-list",
        "value": "none"
      },
      {
        "name": "requirements.scope_addition_count",
        "source_ids": [
          "CTX-SELECTION-3D7E2B0CCDD5C9E637505CBF13F434C4F8DE35100B22EAC4C0C0CC0C7313D5AC",
          "M6-SCHEDULER-STATE-4CAEFB3BD990A30DF7662EBCEBB80F227BB122150E5CA8185366376042A825E2",
          "M6-TASK-GRAPH-812F1666FD65A7A3251D6414346308EBC5BEA7FDEE488408A3A59BFDDA003BE6",
          "M8-INTEGRATED-PLAN-A6C0C7D763505EDA73A7864140C50B094E42ECA48CA26604FC9ADE9AF492A87D",
          "M8-WORKFLOW-EVENT-B200B4C39310BDE44B7B5AC57FD6E13C852FC90C83E77BB8647F2C6631356AA0"
        ],
        "status": "observed",
        "unit": "count",
        "value": 0
      },
      {
        "name": "requirements.blocking_diagnostic_count",
        "source_ids": [
          "CTX-SELECTION-3D7E2B0CCDD5C9E637505CBF13F434C4F8DE35100B22EAC4C0C0CC0C7313D5AC",
          "M6-SCHEDULER-STATE-4CAEFB3BD990A30DF7662EBCEBB80F227BB122150E5CA8185366376042A825E2",
          "M6-TASK-GRAPH-812F1666FD65A7A3251D6414346308EBC5BEA7FDEE488408A3A59BFDDA003BE6",
          "M8-INTEGRATED-PLAN-A6C0C7D763505EDA73A7864140C50B094E42ECA48CA26604FC9ADE9AF492A87D",
          "M8-WORKFLOW-EVENT-B200B4C39310BDE44B7B5AC57FD6E13C852FC90C83E77BB8647F2C6631356AA0"
        ],
        "status": "observed",
        "unit": "count",
        "value": 0
      },
      {
        "name": "context.required_reference_count",
        "source_ids": [
          "CTX-SELECTION-3D7E2B0CCDD5C9E637505CBF13F434C4F8DE35100B22EAC4C0C0CC0C7313D5AC",
          "M6-SCHEDULER-STATE-4CAEFB3BD990A30DF7662EBCEBB80F227BB122150E5CA8185366376042A825E2",
          "M6-TASK-GRAPH-812F1666FD65A7A3251D6414346308EBC5BEA7FDEE488408A3A59BFDDA003BE6",
          "M8-INTEGRATED-PLAN-A6C0C7D763505EDA73A7864140C50B094E42ECA48CA26604FC9ADE9AF492A87D",
          "M8-WORKFLOW-EVENT-B200B4C39310BDE44B7B5AC57FD6E13C852FC90C83E77BB8647F2C6631356AA0"
        ],
        "status": "observed",
        "unit": "count",
        "value": 3
      },
      {
        "name": "context.selected_required_reference_count",
        "source_ids": [
          "CTX-SELECTION-3D7E2B0CCDD5C9E637505CBF13F434C4F8DE35100B22EAC4C0C0CC0C7313D5AC",
          "M6-SCHEDULER-STATE-4CAEFB3BD990A30DF7662EBCEBB80F227BB122150E5CA8185366376042A825E2",
          "M6-TASK-GRAPH-812F1666FD65A7A3251D6414346308EBC5BEA7FDEE488408A3A59BFDDA003BE6",
          "M8-INTEGRATED-PLAN-A6C0C7D763505EDA73A7864140C50B094E42ECA48CA26604FC9ADE9AF492A87D",
          "M8-WORKFLOW-EVENT-B200B4C39310BDE44B7B5AC57FD6E13C852FC90C83E77BB8647F2C6631356AA0"
        ],
        "status": "observed",
        "unit": "count",
        "value": 3
      },
      {
        "name": "context.stale_required_count",
        "source_ids": [
          "CTX-SELECTION-3D7E2B0CCDD5C9E637505CBF13F434C4F8DE35100B22EAC4C0C0CC0C7313D5AC",
          "M6-SCHEDULER-STATE-4CAEFB3BD990A30DF7662EBCEBB80F227BB122150E5CA8185366376042A825E2",
          "M6-TASK-GRAPH-812F1666FD65A7A3251D6414346308EBC5BEA7FDEE488408A3A59BFDDA003BE6",
          "M8-INTEGRATED-PLAN-A6C0C7D763505EDA73A7864140C50B094E42ECA48CA26604FC9ADE9AF492A87D",
          "M8-WORKFLOW-EVENT-B200B4C39310BDE44B7B5AC57FD6E13C852FC90C83E77BB8647F2C6631356AA0"
        ],
        "status": "observed",
        "unit": "count",
        "value": 0
      },
      {
        "name": "context.provenance_missing_count",
        "source_ids": [
          "CTX-SELECTION-3D7E2B0CCDD5C9E637505CBF13F434C4F8DE35100B22EAC4C0C0CC0C7313D5AC",
          "M6-SCHEDULER-STATE-4CAEFB3BD990A30DF7662EBCEBB80F227BB122150E5CA8185366376042A825E2",
          "M6-TASK-GRAPH-812F1666FD65A7A3251D6414346308EBC5BEA7FDEE488408A3A59BFDDA003BE6",
          "M8-INTEGRATED-PLAN-A6C0C7D763505EDA73A7864140C50B094E42ECA48CA26604FC9ADE9AF492A87D",
          "M8-WORKFLOW-EVENT-B200B4C39310BDE44B7B5AC57FD6E13C852FC90C83E77BB8647F2C6631356AA0"
        ],
        "status": "observed",
        "unit": "count",
        "value": 0
      },
      {
        "name": "context.sensitivity_violation_count",
        "source_ids": [
          "CTX-SELECTION-3D7E2B0CCDD5C9E637505CBF13F434C4F8DE35100B22EAC4C0C0CC0C7313D5AC",
          "M6-SCHEDULER-STATE-4CAEFB3BD990A30DF7662EBCEBB80F227BB122150E5CA8185366376042A825E2",
          "M6-TASK-GRAPH-812F1666FD65A7A3251D6414346308EBC5BEA7FDEE488408A3A59BFDDA003BE6",
          "M8-INTEGRATED-PLAN-A6C0C7D763505EDA73A7864140C50B094E42ECA48CA26604FC9ADE9AF492A87D",
          "M8-WORKFLOW-EVENT-B200B4C39310BDE44B7B5AC57FD6E13C852FC90C83E77BB8647F2C6631356AA0"
        ],
        "status": "observed",
        "unit": "count",
        "value": 0
      },
      {
        "name": "context.selected_context_bytes",
        "source_ids": [
          "CTX-SELECTION-3D7E2B0CCDD5C9E637505CBF13F434C4F8DE35100B22EAC4C0C0CC0C7313D5AC",
          "M6-SCHEDULER-STATE-4CAEFB3BD990A30DF7662EBCEBB80F227BB122150E5CA8185366376042A825E2",
          "M6-TASK-GRAPH-812F1666FD65A7A3251D6414346308EBC5BEA7FDEE488408A3A59BFDDA003BE6",
          "M8-INTEGRATED-PLAN-A6C0C7D763505EDA73A7864140C50B094E42ECA48CA26604FC9ADE9AF492A87D",
          "M8-WORKFLOW-EVENT-B200B4C39310BDE44B7B5AC57FD6E13C852FC90C83E77BB8647F2C6631356AA0"
        ],
        "status": "observed",
        "unit": "canonical-utf8-bytes",
        "value": 3643
      },
      {
        "name": "context.context_budget_bytes",
        "source_ids": [
          "CTX-SELECTION-3D7E2B0CCDD5C9E637505CBF13F434C4F8DE35100B22EAC4C0C0CC0C7313D5AC",
          "M6-SCHEDULER-STATE-4CAEFB3BD990A30DF7662EBCEBB80F227BB122150E5CA8185366376042A825E2",
          "M6-TASK-GRAPH-812F1666FD65A7A3251D6414346308EBC5BEA7FDEE488408A3A59BFDDA003BE6",
          "M8-INTEGRATED-PLAN-A6C0C7D763505EDA73A7864140C50B094E42ECA48CA26604FC9ADE9AF492A87D",
          "M8-WORKFLOW-EVENT-B200B4C39310BDE44B7B5AC57FD6E13C852FC90C83E77BB8647F2C6631356AA0"
        ],
        "status": "observed",
        "unit": "canonical-utf8-bytes",
        "value": 65536
      },
      {
        "name": "context.unresolved_contradiction_count",
        "source_ids": [
          "CTX-SELECTION-3D7E2B0CCDD5C9E637505CBF13F434C4F8DE35100B22EAC4C0C0CC0C7313D5AC",
          "M6-SCHEDULER-STATE-4CAEFB3BD990A30DF7662EBCEBB80F227BB122150E5CA8185366376042A825E2",
          "M6-TASK-GRAPH-812F1666FD65A7A3251D6414346308EBC5BEA7FDEE488408A3A59BFDDA003BE6",
          "M8-INTEGRATED-PLAN-A6C0C7D763505EDA73A7864140C50B094E42ECA48CA26604FC9ADE9AF492A87D",